URL,Status,Title,H1,Mobile_PSI_Score
https://finkeepers.us/,200,Professional Bookkeeping Services | Small Business Finance | Finkeepers,Professional Bookkeeping Services for Small Business Success,45
https://finkeepers.us/book-keeping,200,Expert Bookkeeping Services | Small Business Accounting | Finkeepers,Expert Bookkeeping Services for Small Businesses,42
https://finkeepers.us/financial-reporting,200,Financial Reporting Services | Business Analytics | Finkeepers,Professional Financial Reporting & Business Analytics,44
https://finkeepers.us/payroll-assistance,200,Payroll Services | Employee Payment Solutions | Finkeepers,Streamlined Payroll Services & Employee Payment Solutions,43
https://finkeepers.us/cashflow-management,200,Cash Flow Management | Business Finance Planning | Finkeepers,Expert Cash Flow Management & Financial Planning,41
https://finkeepers.us/temporary-cfo,200,Temporary CFO Services | Part-Time Finance Executive | Finkeepers,Temporary CFO Services for Growing Businesses,43
https://finkeepers.us/pricing,200,Affordable Bookkeeping Pricing | Finance Service Plans | Finkeepers,Transparent Pricing for Professional Services,46
https://finkeepers.us/about,200,About Finkeepers | Professional Accounting Team | Finance Experts,About Our Professional Accounting Team,44
https://finkeepers.us/contact,200,Contact Finkeepers | Get Your Free Finance Consultation Today,Contact Our Finance Experts Today,45
https://finkeepers.us/blogs,200,Finance & Accounting Blog | Business Tips | Finkeepers Insights,Latest Finance & Business Insights,43
https://finkeepers.us/casestudy,200,Client Success Stories | Bookkeeping Case Studies | Finkeepers,Client Success Stories & Case Studies,44
https://finkeepers.us/account-reconciliation,200,Account Reconciliation Guide | Professional Bookkeeping | Finkeepers,Account Reconciliation: An Ultimate Guide,42